Phone Number,Website
"The First,B/H, Keshavbaug Party Plot, D-1106, Disha Estate Management, nr. Shivalik Highstreet, Vastrapur, Ahmedabad, Gujarat 380015",https://dishaestate.in/
"109 Abhishree Adroit, Judges Bunglow Rd, Vastrapur, Ahmedabad, Gujarat 380015",http://www.spaceadviser.com/
"18, Chiranjiv complex, Mahalaxmi Five Rd, opposite Nakshtra Flat, Paldi, Ahmedabad, Gujarat 380007",N/A
"525, Shivalik Shilp Iscon Cross Road, Sarkhej - Gandhinagar Hwy, Ahmedabad, Gujarat 380015",https://www.resmanagement.in/
"BSquare II, Near Doubletree by Hilton, 302-303, Ambli Rd, Ahmedabad, Gujarat 380054",http://www.therealestateconnect.com/
"Vaikunth Shopping Center, Nikol - Naroda Rd, nr. Raspan Cross Road, New India Colony, B/H, Nikol, Ahmedabad, Gujarat 382350",https://www.facebook.com/ChamundaEstateBroker/
"FF-112, Shasan Complex, Satellite Rd, opp. Axis Bank, Jodhpur Village, Ahmedabad, Gujarat 380015",N/A
"5 Navniddhi Complex, Swami Vivekanand Marg, near A-One School, Memnagar, Ahmedabad, Gujarat 380052",N/A
"B – 1015, 1016, Sun Westbank, Ashram Rd, Vishalpur, Muslim Society, Navrangpura, Ahmedabad, Gujarat 380009",http://www.divyaestate.com/
